{
  "$schema": "./schema.json",
  "evrakSayisi": "987.65.43.21-01",
  "tarih": "24/07/2026",
  "idareAdi": "KUZEYYAKA BELEDİYE BAŞKANLIĞI",
  "gerekce": "Beldemiz genelindeki park ve rekreasyon alanlarının çevre düzenlemesi ve çocuk oyun alanlarının güvenliğinin artırılması amacıyla gerekli malzemelerin alımı.",
  "isAdi": "Belediyemiz Park ve Bahçeler Müdürlüğü tarafından kullanılmak üzere kent mobilyaları ve çocuk oyun grubu malzemeleri alımı",
  "miktar": "15 Adet Bank, 10 Adet Çöp Kovası, 1 Takım Çocuk Oyun Grubu",
  "sure": "45 Gün",
  "teminSekli": "4734 sayılı Kanun'un 22/d* maddesi gereğince Doğrudan Temin",
  "yaklasikMaliyet": "180.250,00",
  "odenekTutari": "250.000,00 TL",
  "butceTertibi": [
    "46.90.02.05-03.2.9.90"
  ],
  "gerceklestirmeGorevlileri": [
    "Deniz YÜCEL (Teknisyen)"
  ],
  "aciklama": "Kuzeyyaka sınırlarında yer alan çocuk parkları ve yeşil alanlar için kent mobilyalarının temini, montajı ve teslimi işi.",
  "mutemetAdi": "Caner AKSOY",
  "isTutari": "212.695,00",
  "sunumTarihi": "24/07/2026",
  "hazirlayanPersonelAdi": "Deniz YÜCEL",
  "hazirlayanPersonelUnvan": "Teknisyen",
  "olurTarihi": "24/07/2026",
  "onaylayanPersonelAdi": "Kerem ASLAN",
  "onaylayanPersonelUnvan": "Belediye Başkan Yardımcısı"
}
